research/systems/drafter_kernel_tile/microbench-20260616T040228Z.json
{
  "device": "NVIDIA A10G",
  "dims": {
    "num_tokens": 1,
    "hidden_size": 256,
    "vocab_size": 262144,
    "num_centroids": 2048,
    "vocab_per_centroid": 128,
    "centroid_top_k": 64,
    "num_selected": 8192
  },
  "served_default": {
    "block_arg": 16,
    "block_selected": 16,
    "num_warps": 8,
    "num_stages": "triton_default",
    "us": 21.503999829292297,
    "correct": true
  },
  "lm_head_bytes_per_call": 4194304,
  "best": {
    "block_arg": 8,
    "block_selected": 8,
    "num_blocks": 1024,
    "num_warps": 2,
    "num_stages": 2,
    "us": 21.503999829292297,
    "correct": true,
    "speedup_vs_default": 1.0
  },
  "best_speedup": 1.0,
  "best_delta_us": 0.0,
  "n_iters_per_decode_step": 7,
  "results": [
    {
      "block_arg": 8,
      "block_selected": 8,
      "num_blocks": 1024,
      "num_warps": 2,
      "num_stages": 2,
      "us": 21.503999829292297,
      "correct": true,
      "speedup_vs_default": 1.0
    },
    {
      "block_arg": 8,
      "block_selected": 8,
      "num_blocks": 1024,
      "num_warps": 2,
      "num_stages": 3,
      "us": 21.503999829292297,
      "correct": true,
      "speedup_vs_default": 1.0
    },
    {
      "block_arg": 8,
      "block_selected": 8,
      "num_blocks": 1024,
      "num_warps": 2,
      "num_stages": 4,
      "us": 21.503999829292297,
      "correct": true,
      "speedup_vs_default": 1.0
    },
    {
      "block_arg": 8,
      "block_selected": 8,
      "num_blocks": 1024,
      "num_warps": 4,
      "num_stages": 2,
      "us": 21.503999829292297,
      "correct": true,
      "speedup_vs_default": 1.0
    },
    {
      "block_arg": 8,
      "block_selected": 8,
      "num_blocks": 1024,
      "num_warps": 4,
      "num_stages": 3,
      "us": 21.503999829292297,
      "correct": true,
      "speedup_vs_default": 1.0
    },
    {
      "block_arg": 8,
      "block_selected": 8,
      "num_blocks": 1024,
      "num_warps": 4,
      "num_stages": 4,
      "us": 21.503999829292297,
      "correct": true,
      "speedup_vs_default": 1.0
    },
    {
      "block_arg": 8,
      "block_selected": 8,
      "num_blocks": 1024,
      "num_warps": 8,
      "num_stages": 2,
      "us": 21.503999829292297,
      "correct": true,
      "speedup_vs_default": 1.0
    },
    {
      "block_arg": 8,
      "block_selected": 8,
      "num_blocks": 1024,
      "num_warps": 8,
      "num_stages": 3,
      "us": 21.503999829292297,
      "correct": true,
      "speedup_vs_default": 1.0
    },
    {
      "block_arg": 8,
      "block_selected": 8,
      "num_blocks": 1024,
      "num_warps": 8,
      "num_stages": 4,
      "us": 21.503999829292297,
      "correct": true,
      "speedup_vs_default": 1.0
    },
    {
      "block_arg": 16,
      "block_selected": 16,
      "num_blocks": 512,
      "num_warps": 2,
      "num_stages": 2,
      "us": 21.503999829292297,
      "correct": true,
      "speedup_vs_default": 1.0
    },
    {
      "block_arg": 16,
      "block_selected": 16,
      "num_blocks": 512,
      "num_warps": 2,
      "num_stages": 3,
      "us": 21.503999829292297,
      "correct": true,
      "speedup_vs_default": 1.0
    },
    {
      "block_arg": 16,
      "block_selected": 16,
      "num_blocks": 512,
      "num_warps": 2,
      "num_stages": 4,
      "us": 21.503999829292297,
      "correct": true,
      "speedup_vs_default": 1.0
    },
    {
      "block_arg": 16,
      "block_selected": 16,
      "num_blocks": 512,
      "num_warps": 4,
      "num_stages": 2,
      "us": 21.503999829292297,
      "correct": true,
      "speedup_vs_default": 1.0
    },
    {
      "block_arg": 16,
      "block_selected": 16,
      "num_blocks": 512,
      "num_warps": 4,
      "num_stages": 3,
      "us": 21.503999829292297,
      "correct": true,
      "speedup_vs_default": 1.0
    },
    {
      "block_arg": 16,
      "block_selected": 16,
      "num_blocks": 512,
      "num_warps": 4,
      "num_stages": 4,
      "us": 21.503999829292297,
      "correct": true,
      "speedup_vs_default": 1.0
    },
    {
      "block_arg": 16,
      "block_selected": 16,
      "num_blocks": 512,
      "num_warps": 8,
      "num_stages": 2,
      "us": 21.503999829292297,
      "correct": true,
      "speedup_vs_default": 1.0
    },
    {
      "block_arg": 16,
      "block_selected": 16,
      "num_blocks": 512,
      "num_warps": 8,
      "num_stages": 3,
      "us": 21.503999829292297,
      "correct": true,
      "speedup_vs_default": 1.0
    },
    {
      "block_arg": 16,
      "block_selected": 16,
      "num_blocks": 512,
      "num_warps": 8,
      "num_stages": 4,
      "us": 21.503999829292297,
      "correct": true,
      "speedup_vs_default": 1.0
    },
    {
      "block_arg": 32,
      "block_selected": 32,
      "num_blocks": 256,
      "num_warps": 2,
      "num_stages": 2,
      "us": 21.503999829292297,
      "correct": true,
      "speedup_vs_default": 1.0
    },
    {
      "block_arg": 32,
      "block_selected": 32,
      "num_blocks": 256,
      "num_warps": 2,
      "num_stages": 3,
      "us": 21.503999829292297,
      "correct": true,
      "speedup_vs_default": 1.0
    },
    {
      "block_arg": 32,
      "block_selected": 32,
      "num_blocks": 256,
      "num_warps": 2,
      "num_stages": 4,
      "us": 21.503999829292297,
      "correct": true,
      "speedup_vs_default": 1.0
    },
    {
      "block_arg": 32,
      "block_selected": 32,
      "num_blocks": 256,
      "num_warps": 4,
      "num_stages": 2,
      "us": 21.503999829292297,
      "correct": true,
      "speedup_vs_default": 1.0
    },
    {
      "block_arg": 32,
      "block_selected": 32,
      "num_blocks": 256,
      "num_warps": 4,
      "num_stages": 3,
      "us": 21.503999829292297,
      "correct": true,
      "speedup_vs_default": 1.0
    },
    {
      "block_arg": 32,
      "block_selected": 32,
      "num_blocks": 256,
      "num_warps": 4,
      "num_stages": 4,
      "us": 21.503999829292297,
      "correct": true,
      "speedup_vs_default": 1.0
    },
    {
      "block_arg": 32,
      "block_selected": 32,
      "num_blocks": 256,
      "num_warps": 8,
      "num_stages": 2,
      "us": 21.503999829292297,
      "correct": true,
      "speedup_vs_default": 1.0
    },
    {
      "block_arg": 32,
      "block_selected": 32,
      "num_blocks": 256,
      "num_warps": 8,
      "num_stages": 3,
      "us": 21.503999829292297,
      "correct": true,
      "speedup_vs_default": 1.0
    },
    {
      "block_arg": 32,
      "block_selected": 32,
      "num_blocks": 256,
      "num_warps": 8,
      "num_stages": 4,
      "us": 21.503999829292297,
      "correct": true,
      "speedup_vs_default": 1.0
    },
    {
      "block_arg": 64,
      "block_selected": 64,
      "num_blocks": 128,
      "num_warps": 2,
      "num_stages": 2,
      "us": 21.503999829292297,
      "correct": true,
      "speedup_vs_default": 1.0
    },
    {
      "block_arg": 64,
      "block_selected": 64,
      "num_blocks": 128,
      "num_warps": 2,
      "num_stages": 3,
      "us": 21.503999829292297,
      "correct": true,
      "speedup_vs_default": 1.0
    },
    {
      "block_arg": 64,
      "block_selected": 64,
      "num_blocks": 128,
      "num_warps": 2,
      "num_stages": 4,
      "us": 21.503999829292297,
      "correct": true,
      "speedup_vs_default": 1.0
    },
    {
      "block_arg": 64,
      "block_selected": 64,
      "num_blocks": 128,
      "num_warps": 4,
      "num_stages": 2,
      "us": 21.503999829292297,
      "correct": true,
      "speedup_vs_default": 1.0
    },
    {
      "block_arg": 64,
      "block_selected": 64,
      "num_blocks": 128,
      "num_warps": 4,
      "num_stages": 3,
      "us": 21.503999829292297,
      "correct": true,
      "speedup_vs_default": 1.0
    },
    {
      "block_arg": 64,
      "block_selected": 64,
      "num_blocks": 128,
      "num_warps": 4,
      "num_stages": 4,
      "us": 21.503999829292297,
      "correct": true,
      "speedup_vs_default": 1.0
    },
    {
      "block_arg": 64,
      "block_selected": 64,
      "num_blocks": 128,
      "num_warps": 8,
      "num_stages": 2,
      "us": 21.503999829292297,
      "correct": true,
      "speedup_vs_default": 1.0
    },
    {
      "block_arg": 64,
      "block_selected": 64,
      "num_blocks": 128,
      "num_warps": 8,
      "num_stages": 3,
      "us": 21.503999829292297,
      "correct": true,
      "speedup_vs_default": 1.0
    },
    {
      "block_arg": 64,
      "block_selected": 64,
      "num_blocks": 128,
      "num_warps": 8,
      "num_stages": 4,
      "us": 21.503999829292297,
      "correct": true,
      "speedup_vs_default": 1.0
    },
    {
      "block_arg": 128,
      "block_selected": 128,
      "num_blocks": 64,
      "num_warps": 2,
      "num_stages": 2,
      "us": 22.52800017595291,
      "correct": true,
      "speedup_vs_default": 0.9545454395124844
    },
    {
      "block_arg": 128,
      "block_selected": 128,
      "num_blocks": 64,
      "num_warps": 2,
      "num_stages": 3,
      "us": 22.52800017595291,
      "correct": true,
      "speedup_vs_default": 0.9545454395124844
    },
    {
      "block_arg": 128,
      "block_selected": 128,
      "num_blocks": 64,
      "num_warps": 2,
      "num_stages": 4,
      "us": 22.52800017595291,
      "correct": true,
      "speedup_vs_default": 0.9545454395124844
    },
    {
      "block_arg": 128,
      "block_selected": 128,
      "num_blocks": 64,
      "num_warps": 4,
      "num_stages": 2,
      "us": 22.52800017595291,
      "correct": true,
      "speedup_vs_default": 0.9545454395124844
    },
    {
      "block_arg": 128,
      "block_selected": 128,
      "num_blocks": 64,
      "num_warps": 4,
      "num_stages": 3,
      "us": 22.52800017595291,
      "correct": true,
      "speedup_vs_default": 0.9545454395124844
    },
    {
      "block_arg": 128,
      "block_selected": 128,
      "num_blocks": 64,
      "num_warps": 4,
      "num_stages": 4,
      "us": 23.552000522613525,
      "correct": true,
      "speedup_vs_default": 0.9130434507525238
    },
    {
      "block_arg": 128,
      "block_selected": 128,
      "num_blocks": 64,
      "num_warps": 8,
      "num_stages": 2,
      "us": 21.503999829292297,
      "correct": true,
      "speedup_vs_default": 1.0
    },
    {
      "block_arg": 128,
      "block_selected": 128,
      "num_blocks": 64,
      "num_warps": 8,
      "num_stages": 3,
      "us": 21.503999829292297,
      "correct": true,
      "speedup_vs_default": 1.0
    },
    {
      "block_arg": 128,
      "block_selected": 128,
      "num_blocks": 64,
      "num_warps": 8,
      "num_stages": 4,
      "us": 21.503999829292297,
      "correct": true,
      "speedup_vs_default": 1.0
    }
  ]
}