research/systems/drafter_kernel_tile/precise-20260616T040556Z.json
{
  "device": "NVIDIA A10G",
  "default_full_us": 40.68864059448242,
  "best": {
    "name": "served_default",
    "block_arg": 16,
    "num_warps": 8,
    "num_stages": null,
    "full_us": 40.68864059448242,
    "full_min_us": 40.07014465332031,
    "blocks_us": 22.939135551452637,
    "reduce_us": 16.33792018890381,
    "x_vs_default": 1.0,
    "correct": true
  },
  "best_delta_us_per_call": 0.0,
  "rows": [
    {
      "name": "served_default",
      "block_arg": 16,
      "num_warps": 8,
      "num_stages": null,
      "full_us": 40.68864059448242,
      "full_min_us": 40.07014465332031,
      "blocks_us": 22.939135551452637,
      "reduce_us": 16.33792018890381,
      "x_vs_default": 1.0,
      "correct": true
    },
    {
      "name": "b16_w4_s2",
      "block_arg": 16,
      "num_warps": 4,
      "num_stages": 2,
      "full_us": 42.09152030944824,
      "full_min_us": 41.419776916503906,
      "blocks_us": 23.29958438873291,
      "reduce_us": 16.88985538482666,
      "x_vs_default": 0.966670728340242,
      "correct": true
    },
    {
      "name": "b16_w8_s2",
      "block_arg": 16,
      "num_warps": 8,
      "num_stages": 2,
      "full_us": 41.79507255554199,
      "full_min_us": 41.08902359008789,
      "blocks_us": 23.19923210144043,
      "reduce_us": 16.91648006439209,
      "x_vs_default": 0.9735272152096586,
      "correct": true
    },
    {
      "name": "b32_w8_s2",
      "block_arg": 32,
      "num_warps": 8,
      "num_stages": 2,
      "full_us": 40.97433662414551,
      "full_min_us": 40.29849624633789,
      "blocks_us": 22.947327613830566,
      "reduce_us": 16.981504440307617,
      "x_vs_default": 0.9930274397781286,
      "correct": true
    },
    {
      "name": "b32_w4_s2",
      "block_arg": 32,
      "num_warps": 4,
      "num_stages": 2,
      "full_us": 41.155073165893555,
      "full_min_us": 40.44287872314453,
      "blocks_us": 22.990848541259766,
      "reduce_us": 16.812543869018555,
      "x_vs_default": 0.9886664623452138,
      "correct": true
    },
    {
      "name": "b64_w8_s2",
      "block_arg": 64,
      "num_warps": 8,
      "num_stages": 2,
      "full_us": 41.171457290649414,
      "full_min_us": 40.69990539550781,
      "blocks_us": 23.230463981628418,
      "reduce_us": 17.92255973815918,
      "x_vs_default": 0.9882730238874337,
      "correct": true
    },
    {
      "name": "b8_w4_s2",
      "block_arg": 8,
      "num_warps": 4,
      "num_stages": 2,
      "full_us": 41.714176177978516,
      "full_min_us": 40.864768981933594,
      "blocks_us": 24.403968811035156,
      "reduce_us": 17.901567459106445,
      "x_vs_default": 0.9754151783048399,
      "correct": true
    },
    {
      "name": "b8_w2_s2",
      "block_arg": 8,
      "num_warps": 2,
      "num_stages": 2,
      "full_us": 42.146305084228516,
      "full_min_us": 41.11360168457031,
      "blocks_us": 23.31494426727295,
      "reduce_us": 17.776639938354492,
      "x_vs_default": 0.9654141807488703,
      "correct": true
    }
  ],
  "D_us": 1433.0,
  "V_us": 6445.0
}