research/profiling/verify_wall_tile_scan/verify_wall_tile_scan_results.json
{
  "measurement": {
    "facts": {
      "name": "NVIDIA A10G",
      "sm_count": 80,
      "compute_capability": "8.6",
      "total_mem_gib": 22.06,
      "is_a10g_sm86": true
    },
    "iters": 300,
    "warmup": 100,
    "context_len": 128,
    "served_tile_defaults": {
      "BLOCK_M": 16,
      "BLOCK_Q": 4,
      "TILE_SIZE_DECODE_global": 16,
      "num_par_softmax_segments": 16
    },
    "components_us": {
      "attention": 838.823254,
      "int4_gemm_body": 5029.894819,
      "lm_head": 37.792425,
      "sampling": 4.949333,
      "dispatch": 0.0
    },
    "fractions": {
      "attention": 0.141898,
      "int4_gemm_body": 0.850872,
      "lm_head": 0.006393,
      "sampling": 0.000837,
      "dispatch": 0.0
    },
    "t_verify_us": 5911.459832,
    "t_verify_graph_us": 5756.081543,
    "comp_sum_us": 5911.459832,
    "overlap_factor": 0.973716,
    "attn_breakdown_us": {
      "fa2_h256_each": 21.814613,
      "fa2_h256_x35": 763.511467,
      "tri3d_h512_each": 10.758827,
      "tri3d_h512_x7": 75.311787,
      "tri3d_tunable_frac_of_attn": 0.089783
    },
    "body_per_shape": {
      "q_full": {
        "us_each": 9.755307,
        "count": 7,
        "us_total": 68.287149,
        "captured": true
      },
      "q_slide": {
        "us_each": 7.642454,
        "count": 35,
        "us_total": 267.485873,
        "captured": true
      },
      "kv_full": {
        "us_each": 8.106666,
        "count": 8,
        "us_total": 64.853331,
        "captured": true
      },
      "kv_slide": {
        "us_each": 11.393707,
        "count": 40,
        "us_total": 455.748272,
        "captured": true
      },
      "o_full": {
        "us_each": 9.39008,
        "count": 7,
        "us_total": 65.73056,
        "captured": true
      },
      "o_slide": {
        "us_each": 7.072426,
        "count": 35,
        "us_total": 247.534927,
        "captured": true
      },
      "gate_up": {
        "us_each": 30.42304,
        "count": 84,
        "us_total": 2555.535393,
        "captured": true
      },
      "down": {
        "us_each": 31.064746,
        "count": 42,
        "us_total": 1304.719315,
        "captured": true
      }
    },
    "attn_sweep": {
      "baseline_us": 10.752,
      "best": {
        "us": 10.123947,
        "cfg": "BM16_BQ4_TS16_w4_s2",
        "valid": true,
        "max_abs_err": 0.0,
        "cfg_dict": {
          "BLOCK_M": 16,
          "BLOCK_Q": 4,
          "TILE_SIZE": 16,
          "num_warps": 4,
          "num_stages": 2,
          "q_rows": 8,
          "num_seqs": 1
        }
      },
      "n_configs": 180,
      "n_valid": 45,
      "sweep_min_delta_us_per_layer": 0.628053,
      "sweep_min_speedup_pct": 5.84127,
      "confirm": {
        "confirmed": true,
        "reps": 7,
        "base_median_us": 10.786134,
        "best_median_us": 10.12736,
        "delta_us_per_layer": 0.658774,
        "speedup_pct": 6.107597,
        "base_samples": [
          10.789547,
          10.76224,
          10.786134,
          10.779307,
          10.786134,
          10.779307,
          10.786134
        ],
        "best_samples": [
          10.1376,
          10.120533,
          10.1376,
          10.120533,
          10.134187,
          10.123947,
          10.12736
        ]
      },
      "kernel_delta_us_per_layer": 0.658774,
      "kernel_delta_us_x7": 4.611415,
      "kernel_speedup_pct": 6.107597,
      "rows": [
        {
          "BLOCK_M": 4,
          "BLOCK_Q": 1,
          "TILE_SIZE": 16,
          "num_warps": 2,
          "num_stages": 2,
          "us": 10.984107,
          "valid": true,
          "max_abs_err": 0.0,
          "captured": true
        },
        {
          "BLOCK_M": 4,
          "BLOCK_Q": 1,
          "TILE_SIZE": 16,
          "num_warps": 2,
          "num_stages": 3,
          "us": 12.71808,
          "valid": true,
          "max_abs_err": 0.0,
          "captured": true
        },
        {
          "BLOCK_M": 4,
          "BLOCK_Q": 1,
          "TILE_SIZE": 16,
          "num_warps": 2,
          "num_stages": 4,
          "us": 12.704426,
          "valid": true,
          "max_abs_err": 0.0,
          "captured": true
        },
        {
          "BLOCK_M": 4,
          "BLOCK_Q": 1,
          "TILE_SIZE": 16,
          "num_warps": 4,
          "num_stages": 2,
          "us": 10.789547,
          "valid": true,
          "max_abs_err": 0.0,
          "captured": true
        },
        {
          "BLOCK_M": 4,
          "BLOCK_Q": 1,
          "TILE_SIZE": 16,
          "num_warps": 4,
          "num_stages": 3,
          "us": 11.649706,
          "valid": true,
          "max_abs_err": 0.0,
          "captured": true
        },
        {
          "BLOCK_M": 4,
          "BLOCK_Q": 1,
          "TILE_SIZE": 16,
          "num_warps": 4,
          "num_stages": 4,
          "us": 11.656533,
          "valid": true,
          "max_abs_err": 0.0,
          "captured": true
        },
        {
          "BLOCK_M": 4,
          "BLOCK_Q": 1,
          "TILE_SIZE": 16,
          "num_warps": 8,
          "num_stages": 2,
          "us": 11.373227,
          "valid": true,
          "max_abs_err": 0.0,
          "captured": true
        },
        {
          "BLOCK_M": 4,
          "BLOCK_Q": 1,
          "TILE_SIZE": 16,
          "num_warps": 8,
          "num_stages": 3,
          "us": 11.956906,
          "valid": true,
          "max_abs_err": 0.0,
          "captured": true
        },
        {
          "BLOCK_M": 4,
          "BLOCK_Q": 1,
          "TILE_SIZE": 16,
          "num_warps": 8,
          "num_stages": 4,
          "us": 11.956906,
          "valid": true,
          "max_abs_err": 0.0,
          "captured": true
        },
        {
          "BLOCK_M": 4,
          "BLOCK_Q": 1,
          "TILE_SIZE": 32,
          "num_warps": 2,
          "num_stages": 2,
          "us": 13.24032,
          "valid": false,
          "max_abs_err": 0.010925,
          "captured": true
        },
        {
          "BLOCK_M": 4,
          "BLOCK_Q": 1,
          "TILE_SIZE": 32,
          "num_warps": 2,
          "num_stages": 3,
          "us": 17.41824,
          "valid": false,
          "max_abs_err": 0.010925,
          "captured": true
        },
        {
          "BLOCK_M": 4,
          "BLOCK_Q": 1,
          "TILE_SIZE": 32,
          "num_warps": 2,
          "num_stages": 4,
          "us": 17.41824,
          "valid": false,
          "max_abs_err": 0.010925,
          "captured": true
        },
        {
          "BLOCK_M": 4,
          "BLOCK_Q": 1,
          "TILE_SIZE": 32,
          "num_warps": 4,
          "num_stages": 2,
          "us": 11.260587,
          "valid": false,
          "max_abs_err": 0.010925,
          "captured": true
        },
        {
          "BLOCK_M": 4,
          "BLOCK_Q": 1,
          "TILE_SIZE": 32,
          "num_warps": 4,
          "num_stages": 3,
          "us": 13.632854,
          "valid": false,
          "max_abs_err": 0.010925,
          "captured": true
        },
        {
          "BLOCK_M": 4,
          "BLOCK_Q": 1,
          "TILE_SIZE": 32,
          "num_warps": 4,
          "num_stages": 4,
          "us": 13.636266,
          "valid": false,
          "max_abs_err": 0.010925,
          "captured": true
        },
        {
          "BLOCK_M": 4,
          "BLOCK_Q": 1,
          "TILE_SIZE": 32,
          "num_warps": 8,
          "num_stages": 2,
          "us": 11.762346,
          "valid": false,
          "max_abs_err": 0.010925,
          "captured": true
        },
        {
          "BLOCK_M": 4,
          "BLOCK_Q": 1,
          "TILE_SIZE": 32,
          "num_warps": 8,
          "num_stages": 3,
          "us": 12.588373,
          "valid": false,
          "max_abs_err": 0.010925,
          "captured": true
        },
        {
          "BLOCK_M": 4,
          "BLOCK_Q": 1,
          "TILE_SIZE": 32,
          "num_warps": 8,
          "num_stages": 4,
          "us": 12.591786,
          "valid": false,
          "max_abs_err": 0.010925,
          "captured": true
        },
        {
          "BLOCK_M": 4,
          "BLOCK_Q": 1,
          "TILE_SIZE": 64,
          "num_warps": 2,
          "num_stages": 2,
          "us": null,
          "valid": false,
          "max_abs_err": null,
          "captured": false
        },
        {
          "BLOCK_M": 4,
          "BLOCK_Q": 1,
          "TILE_SIZE": 64,
          "num_warps": 2,
          "num_stages": 3,
          "us": null,
          "valid": false,
          "max_abs_err": null,
          "captured": false
        },
        {
          "BLOCK_M": 4,
          "BLOCK_Q": 1,
          "TILE_SIZE": 64,
          "num_warps": 2,
          "num_stages": 4,
          "us": null,
          "valid": false,
          "max_abs_err": null,
          "captured": false
        },
        {
          "BLOCK_M": 4,
          "BLOCK_Q": 1,
          "TILE_SIZE": 64,
          "num_warps": 4,
          "num_stages": 2,
          "us": null,
          "valid": false,
          "max_abs_err": null,
          "captured": false
        },
        {
          "BLOCK_M": 4,
          "BLOCK_Q": 1,
          "TILE_SIZE": 64,
          "num_warps": 4,
          "num_stages": 3,
          "us": null,
          "valid": false,
          "max_abs_err": null,
          "captured": false
        },
        {
          "BLOCK_M": 4,
          "BLOCK_Q": 1,
          "TILE_SIZE": 64,
          "num_warps": 4,
          "num_stages": 4,
          "us": null,
          "valid": false,
          "max_abs_err": null,
          "captured": false
        },
        {
          "BLOCK_M": 4,
          "BLOCK_Q": 1,
          "TILE_SIZE": 64,
          "num_warps": 8,
          "num_stages": 2,
          "us": null,
          "valid": false,
          "max_abs_err": null,
          "captured": false
        },
        {
          "BLOCK_M": 4,
          "BLOCK_Q": 1,
          "TILE_SIZE": 64,
          "num_warps": 8,
          "num_stages": 3,
          "us": null,
          "valid": false,
          "max_abs_err": null,
          "captured": false
        },
        {
          "BLOCK_M": 4,
          "BLOCK_Q": 1,
          "TILE_SIZE": 64,
          "num_warps": 8,
          "num_stages": 4,
          "us": null,
          "valid": false,
          "max_abs_err": null,
          "captured": false
        },
        {
          "BLOCK_M": 4,
          "BLOCK_Q": 1,
          "TILE_SIZE": 128,
          "num_warps": 2,
          "num_stages": 2,
          "us": null,
          "valid": false,
          "max_abs_err": null,
          "captured": false
        },
        {
          "BLOCK_M": 4,
          "BLOCK_Q": 1,
          "TILE_SIZE": 128,
          "num_warps": 2,
          "num_stages": 3,
          "us": null,
          "valid": false,
          "max_abs_err": null,
          "captured": false
        },
        {
          "BLOCK_M": 4,
          "BLOCK_Q": 1,
          "TILE_SIZE": 128,
          "num_warps": 2,
          "num_stages": 4,
          "us": null,
          "valid": false,
          "max_abs_err": null,
          "captured": false
        },
        {
          "BLOCK_M": 4,
          "BLOCK_Q": 1,
          "TILE_SIZE": 128,
          "num_warps": 4,
          "num_stages": 2,
          "us": null,
          "valid": false,
          "max_abs_err": null,
          "captured": false
        },
        {
          "BLOCK_M": 4,
          "BLOCK_Q": 1,
          "TILE_SIZE": 128,
          "num_warps": 4,
          "num_stages": 3,
          "us": null,
          "valid": false,
          "max_abs_err": null,
          "captured": false
        },
        {
          "BLOCK_M": 4,
          "BLOCK_Q": 1,
          "TILE_SIZE": 128,
          "num_warps": 4,
          "num_stages": 4,
          "us": null,
          "valid": false,
          "max_abs_err": null,
          "captured": false
        },
        {
          "BLOCK_M": 4,
          "BLOCK_Q": 1,
          "TILE_SIZE": 128,
          "num_warps": 8,
          "num_stages": 2,
          "us": null,
          "valid": false,
          "max_abs_err": null,
          "captured": false
        },
        {
          "BLOCK_M": 4,
          "BLOCK_Q": 1,
          "TILE_SIZE": 128,
          "num_warps": 8,
          "num_stages": 3,
          "us": null,
          "valid": false,
          "max_abs_err": null,
          "captured": false
        },
        {
          "BLOCK_M": 4,
          "BLOCK_Q": 1,
          "TILE_SIZE": 128,
          "num_warps": 8,
          "num_stages": 4,
          "us": null,
          "valid": false,
          "max_abs_err": null,
          "captured": false
        },
        {
          "BLOCK_M": 8,
          "BLOCK_Q": 2,
          "TILE_SIZE": 16,
          "num_warps": 2,
          "num_stages": 2,
          "us": 10.257067,
          "valid": true,
          "max_abs_err": 0.0,
          "captured": true
        },
        {
          "BLOCK_M": 8,
          "BLOCK_Q": 2,
          "TILE_SIZE": 16,
          "num_warps": 2,
          "num_stages": 3,
          "us": 12.619093,
          "valid": true,
          "max_abs_err": 0.0,
          "captured": true
        },
        {
          "BLOCK_M": 8,
          "BLOCK_Q": 2,
          "TILE_SIZE": 16,
          "num_warps": 2,
          "num_stages": 4,
          "us": 12.632747,
          "valid": true,
          "max_abs_err": 0.0,
          "captured": true
        },
        {
          "BLOCK_M": 8,
          "BLOCK_Q": 2,
          "TILE_SIZE": 16,
          "num_warps": 4,
          "num_stages": 2,
          "us": 10.284373,
          "valid": true,
          "max_abs_err": 0.0,
          "captured": true
        },
        {
          "BLOCK_M": 8,
          "BLOCK_Q": 2,
          "TILE_SIZE": 16,
          "num_warps": 4,
          "num_stages": 3,
          "us": 11.38688,
          "valid": true,
          "max_abs_err": 0.0,
          "captured": true
        },
        {
          "BLOCK_M": 8,
          "BLOCK_Q": 2,
          "TILE_SIZE": 16,
          "num_warps": 4,
          "num_stages": 4,
          "us": 11.380053,
          "valid": true,
          "max_abs_err": 0.0,
          "captured": true
        },
        {
          "BLOCK_M": 8,
          "BLOCK_Q": 2,
          "TILE_SIZE": 16,
          "num_warps": 8,
          "num_stages": 2,
          "us": 11.328853,
          "valid": true,
          "max_abs_err": 0.0,
          "captured": true
        },
        {
          "BLOCK_M": 8,
          "BLOCK_Q": 2,
          "TILE_SIZE": 16,
          "num_warps": 8,
          "num_stages": 3,
          "us": 12.588373,
          "valid": true,
          "max_abs_err": 0.0,
          "captured": true
        },
        {
          "BLOCK_M": 8,
          "BLOCK_Q": 2,
          "TILE_SIZE": 16,
          "num_warps": 8,
          "num_stages": 4,
          "us": 12.598613,
          "valid": true,
          "max_abs_err": 0.0,
          "captured": true
        },
        {
          "BLOCK_M": 8,
          "BLOCK_Q": 2,
          "TILE_SIZE": 32,
          "num_warps": 2,
          "num_stages": 2,
          "us": 12.243627,
          "valid": false,
          "max_abs_err": 0.010925,
          "captured": true
        },
        {
          "BLOCK_M": 8,
          "BLOCK_Q": 2,
          "TILE_SIZE": 32,
          "num_warps": 2,
          "num_stages": 3,
          "us": 17.370453,
          "valid": false,
          "max_abs_err": 0.010925,
          "captured": true
        },
        {
          "BLOCK_M": 8,
          "BLOCK_Q": 2,
          "TILE_SIZE": 32,
          "num_warps": 2,
          "num_stages": 4,
          "us": 16.896,
          "valid": false,
          "max_abs_err": 0.010925,
          "captured": true
        },
        {
          "BLOCK_M": 8,
          "BLOCK_Q": 2,
          "TILE_SIZE": 32,
          "num_warps": 4,
          "num_stages": 2,
          "us": 10.154667,
          "valid": false,
          "max_abs_err": 0.010925,
          "captured": true
        },
        {
          "BLOCK_M": 8,
          "BLOCK_Q": 2,
          "TILE_SIZE": 32,
          "num_warps": 4,
          "num_stages": 3,
          "us": 12.653227,
          "valid": false,
          "max_abs_err": 0.010925,
          "captured": true
        },
        {
          "BLOCK_M": 8,
          "BLOCK_Q": 2,
          "TILE_SIZE": 32,
          "num_warps": 4,
          "num_stages": 4,
          "us": 12.663467,
          "valid": false,
          "max_abs_err": 0.010925,
          "captured": true
        },
        {
          "BLOCK_M": 8,
          "BLOCK_Q": 2,
          "TILE_SIZE": 32,
          "num_warps": 8,
          "num_stages": 2,
          "us": 10.676907,
          "valid": false,
          "max_abs_err": 0.010925,
          "captured": true
        },
        {
          "BLOCK_M": 8,
          "BLOCK_Q": 2,
          "TILE_SIZE": 32,
          "num_warps": 8,
          "num_stages": 3,
          "us": 11.73504,
          "valid": false,
          "max_abs_err": 0.010925,
          "captured": true
        },
        {
          "BLOCK_M": 8,
          "BLOCK_Q": 2,
          "TILE_SIZE": 32,
          "num_warps": 8,
          "num_stages": 4,
          "us": 11.758933,
          "valid": false,
          "max_abs_err": 0.010925,
          "captured": true
        },
        {
          "BLOCK_M": 8,
          "BLOCK_Q": 2,
          "TILE_SIZE": 64,
          "num_warps": 2,
          "num_stages": 2,
          "us": null,
          "valid": false,
          "max_abs_err": null,
          "captured": false
        },
        {
          "BLOCK_M": 8,
          "BLOCK_Q": 2,
          "TILE_SIZE": 64,
          "num_warps": 2,
          "num_stages": 3,
          "us": null,
          "valid": false,
          "max_abs_err": null,
          "captured": false
        },
        {
          "BLOCK_M": 8,
          "BLOCK_Q": 2,
          "TILE_SIZE": 64,
          "num_warps": 2,
          "num_stages": 4,
          "us": null,
          "valid": false,
          "max_abs_err": null,
          "captured": false
        },
        {
          "BLOCK_M": 8,
          "BLOCK_Q": 2,
          "TILE_SIZE": 64,
          "num_warps": 4,
          "num_stages": 2,
          "us": null,
          "valid": false,
          "max_abs_err": null,
          "captured": false
        },
        {
          "BLOCK_M": 8,
          "BLOCK_Q": 2,
          "TILE_SIZE": 64,
          "num_warps": 4,
          "num_stages": 3,
          "us": null,
          "valid": false,
          "max_abs_err": null,
          "captured": false
        },
        {
          "BLOCK_M": 8,
          "BLOCK_Q": 2,
          "TILE_SIZE": 64,
          "num_warps": 4,
          "num_stages": 4,
          "us": null,
          "valid": false,
          "max_abs_err": null,
          "captured": false
        },
        {
          "BLOCK_M": 8,
          "BLOCK_Q": 2,
          "TILE_SIZE": 64,
          "num_warps": 8,
          "num_stages": 2,
          "us": null,
          "valid": false,
          "max_abs_err": null,
          "captured": false
        },
        {
          "BLOCK_M": 8,
          "BLOCK_Q": 2,
          "TILE_SIZE": 64,
          "num_warps": 8,
          "num_stages": 3,
          "us": null,
          "valid": false,
          "max_abs_err": null,
          "captured": false
        },
        {
          "BLOCK_M": 8,
          "BLOCK_Q": 2,
          "TILE_SIZE": 64,
          "num_warps": 8,
          "num_stages": 4,
          "us": null,
          "valid": false,
          "max_abs_err": null,
          "captured": false
        },
        {
          "BLOCK_M": 8,
          "BLOCK_Q": 2,
          "TILE_SIZE": 128,
          "num_warps": 2,
          "num_stages": 2,
          "us": null,
          "valid": false,
          "max_abs_err": null,
          "captured": false
        },
        {
          "BLOCK_M": 8,
          "BLOCK_Q": 2,
          "TILE_SIZE": 128,
          "num_warps": 2,
          "num_stages": 3,
          "us": null,
          "valid": false,
          "max_abs_err": null,
          "captured": false
        },
        {
          "BLOCK_M": 8,
          "BLOCK_Q": 2,
          "TILE_SIZE": 128,
          "num_warps": 2,
          "num_stages": 4,
          "us": null,
          "valid": false,
          "max_abs_err": null,
          "captured": false
        },
        {
          "BLOCK_M": 8,
          "BLOCK_Q": 2,
          "TILE_SIZE": 128,
          "num_warps": 4,
          "num_stages": 2,
          "us": null,
          "valid": false,
          "max_abs_err": null,
          "captured": false
        },
        {
          "BLOCK_M": 8,
          "BLOCK_Q": 2,
          "TILE_SIZE": 128,
          "num_warps": 4,
          "num_stages": 3,
          "us": null,
          "valid": false,
          "max_abs_err": null,
          "captured": false
        },
        {
          "BLOCK_M": 8,
          "BLOCK_Q": 2,
          "TILE_SIZE": 128,
          "num_warps": 4,
          "num_stages": 4,
          "us": null,
          "valid": false,
          "max_abs_err": null,
          "captured": false
        },
        {
          "BLOCK_M": 8,
          "BLOCK_Q": 2,
          "TILE_SIZE": 128,
          "num_warps": 8,
          "num_stages": 2,
          "us": null,
          "valid": false,
          "max_abs_err": null,
          "captured": false
        },
        {
          "BLOCK_M": 8,
          "BLOCK_Q": 2,
          "TILE_SIZE": 128,
          "num_warps": 8,
          "num_stages": 3,
          "us": null,
          "valid": false,
          "max_abs_err": null,
          "captured": false
        },
        {
          "BLOCK_M": 8,
          "BLOCK_Q": 2,
          "TILE_SIZE": 128,
          "num_warps": 8,
          "num_stages": 4,
          "us": null,
          "valid": false,
          "max_abs_err": null,
          "captured": false
        },
        {
          "BLOCK_M": 16,
          "BLOCK_Q": 4,
          "TILE_SIZE": 16,
          "num_warps": 2,
          "num_stages": 2,
          "us": 10.523307,
          "valid": true,
          "max_abs_err": 0.0,
          "captured": true
        },
        {
          "BLOCK_M": 16,
          "BLOCK_Q": 4,
          "TILE_SIZE": 16,
          "num_warps": 2,
          "num_stages": 3,
          "us": 12.776107,
          "valid": true,
          "max_abs_err": 0.0,
          "captured": true
        },
        {
          "BLOCK_M": 16,
          "BLOCK_Q": 4,
          "TILE_SIZE": 16,
          "num_warps": 2,
          "num_stages": 4,
          "us": 12.76928,
          "valid": true,
          "max_abs_err": 0.0,
          "captured": true
        },
        {
          "BLOCK_M": 16,
          "BLOCK_Q": 4,
          "TILE_SIZE": 16,
          "num_warps": 4,
          "num_stages": 2,
          "us": 10.123947,
          "valid": true,
          "max_abs_err": 0.0,
          "captured": true
        },
        {
          "BLOCK_M": 16,
          "BLOCK_Q": 4,
          "TILE_SIZE": 16,
          "num_warps": 4,
          "num_stages": 3,
          "us": 10.77248,
          "valid": true,
          "max_abs_err": 0.0,
          "captured": true
        },
        {
          "BLOCK_M": 16,
          "BLOCK_Q": 4,
          "TILE_SIZE": 16,
          "num_warps": 4,
          "num_stages": 4,
          "us": 10.769067,
          "valid": true,
          "max_abs_err": 0.0,
          "captured": true
        },
        {
          "BLOCK_M": 16,
          "BLOCK_Q": 4,
          "TILE_SIZE": 16,
          "num_warps": 8,
          "num_stages": 2,
          "us": 10.458453,
          "valid": true,
          "max_abs_err": 0.0,
          "captured": true
        },
        {
          "BLOCK_M": 16,
          "BLOCK_Q": 4,
          "TILE_SIZE": 16,
          "num_warps": 8,
          "num_stages": 3,
          "us": 11.086507,
          "valid": true,
          "max_abs_err": 0.0,
          "captured": true
        },
        {
          "BLOCK_M": 16,
          "BLOCK_Q": 4,
          "TILE_SIZE": 16,
          "num_warps": 8,
          "num_stages": 4,
          "us": 11.07968,
          "valid": true,
          "max_abs_err": 0.0,
          "captured": true
        },
        {
          "BLOCK_M": 16,
          "BLOCK_Q": 4,
          "TILE_SIZE": 32,
          "num_warps": 2,
          "num_stages": 2,
          "us": 12.997973,
          "valid": false,
          "max_abs_err": 0.010925,
          "captured": true
        },
        {
          "BLOCK_M": 16,
          "BLOCK_Q": 4,
          "TILE_SIZE": 32,
          "num_warps": 2,
          "num_stages": 3,
          "us": 18.117973,
          "valid": false,
          "max_abs_err": 0.010925,
          "captured": true
        },
        {
          "BLOCK_M": 16,
          "BLOCK_Q": 4,
          "TILE_SIZE": 32,
          "num_warps": 2,
          "num_stages": 4,
          "us": 18.203306,
          "valid": false,
          "max_abs_err": 0.010925,
          "captured": true
        },
        {
          "BLOCK_M": 16,
          "BLOCK_Q": 4,
          "TILE_SIZE": 32,
          "num_warps": 4,
          "num_stages": 2,
          "us": 10.61888,
          "valid": false,
          "max_abs_err": 0.010925,
          "captured": true
        },
        {
          "BLOCK_M": 16,
          "BLOCK_Q": 4,
          "TILE_SIZE": 32,
          "num_warps": 4,
          "num_stages": 3,
          "us": 12.98432,
          "valid": false,
          "max_abs_err": 0.010925,
          "captured": true
        },
        {
          "BLOCK_M": 16,
          "BLOCK_Q": 4,
          "TILE_SIZE": 32,
          "num_warps": 4,
          "num_stages": 4,
          "us": 12.967254,
          "valid": false,
          "max_abs_err": 0.010925,
          "captured": true
        },
        {
          "BLOCK_M": 16,
          "BLOCK_Q": 4,
          "TILE_SIZE": 32,
          "num_warps": 8,
          "num_stages": 2,
          "us": 11.1616,
          "valid": false,
          "max_abs_err": 0.010925,
          "captured": true
        },
        {
          "BLOCK_M": 16,
          "BLOCK_Q": 4,
          "TILE_SIZE": 32,
          "num_warps": 8,
          "num_stages": 3,
          "us": 12.243627,
          "valid": false,
          "max_abs_err": 0.010925,
          "captured": true
        },
        {
          "BLOCK_M": 16,
          "BLOCK_Q": 4,
          "TILE_SIZE": 32,
          "num_warps": 8,
          "num_stages": 4,
          "us": 12.22656,
          "valid": false,
          "max_abs_err": 0.010925,
          "captured": true
        },
        {
          "BLOCK_M": 16,
          "BLOCK_Q": 4,
          "TILE_SIZE": 64,
          "num_warps": 2,
          "num_stages": 2,
          "us": null,
          "valid": false,
          "max_abs_err": null,
          "captured": false
        },
        {
          "BLOCK_M": 16,
          "BLOCK_Q": 4,
          "TILE_SIZE": 64,
          "num_warps": 2,
          "num_stages": 3,
          "us": null,
          "valid": false,
          "max_abs_err": null,
          "captured": false
        },
        {
          "BLOCK_M": 16,
          "BLOCK_Q": 4,
          "TILE_SIZE": 64,
          "num_warps": 2,
          "num_stages": 4,
          "us": null,
          "valid": false,
          "max_abs_err": null,
          "captured": false
        },
        {
          "BLOCK_M": 16,
          "BLOCK_Q": 4,
          "TILE_SIZE": 64,
          "num_warps": 4,
          "num_stages": 2,
          "us": null,
          "valid": false,
          "max_abs_err": null,
          "captured": false
        },
        {
          "BLOCK_M": 16,
          "BLOCK_Q": 4,
          "TILE_SIZE": 64,
          "num_warps": 4,
          "num_stages": 3,
          "us": null,
          "valid": false,
          "max_abs_err": null,
          "captured": false
        },
        {
          "BLOCK_M": 16,
          "BLOCK_Q": 4,
          "TILE_SIZE": 64,
          "num_warps": 4,
          "num_stages": 4,
          "us": null,
          "valid": false,
          "max_abs_err": null,
          "captured": false
        },
        {
          "BLOCK_M": 16,
          "BLOCK_Q": 4,
          "TILE_SIZE": 64,
          "num_warps": 8,
          "num_stages": 2,
          "us": null,
          "valid": false,
          "max_abs_err": null,
          "captured": false
        },
        {
          "BLOCK_M": 16,
          "BLOCK_Q": 4,
          "TILE_SIZE": 64,
          "num_warps": 8,
          "num_stages": 3,
          "us": null,
          "valid": false,
          "max_abs_err": null,
          "captured": false
        },
        {
          "BLOCK_M": 16,
          "BLOCK_Q": 4,
          "TILE_SIZE": 64,
          "num_warps": 8,
          "num_stages": 4,
          "us": null,
          "valid": false,
          "max_abs_err": null,
          "captured": false
        },
        {
          "BLOCK_M": 16,
          "BLOCK_Q": 4,
          "TILE_SIZE": 128,
          "num_warps": 2,
          "num_stages": 2,
          "us": null,
          "valid": false,
          "max_abs_err": null,
          "captured": false
        },
        {
          "BLOCK_M": 16,
          "BLOCK_Q": 4,
          "TILE_SIZE": 128,
          "num_warps": 2,
          "num_stages": 3,
          "us": null,
          "valid": false,
          "max_abs_err": null,
          "captured": false
        },
        {
          "BLOCK_M": 16,
          "BLOCK_Q": 4,
          "TILE_SIZE": 128,
          "num_warps": 2,
          "num_stages": 4,
          "us": null,
          "valid": false,
          "max_abs_err": null,
          "captured": false
        },
        {
          "BLOCK_M": 16,
          "BLOCK_Q": 4,
          "TILE_SIZE": 128,
          "num_warps": 4,
          "num_stages": 2,
          "us": null,
          "valid": false,
          "max_abs_err": null,
          "captured": false
        },
        {
          "BLOCK_M": 16,
          "BLOCK_Q": 4,
          "TILE_SIZE": 128,
          "num_warps": 4,
          "num_stages": 3,
          "us": null,
          "valid": false,
          "max_abs_err": null,
          "captured": false
        },
        {
          "BLOCK_M": 16,
          "BLOCK_Q": 4,
          "TILE_SIZE": 128,
          "num_warps": 4,
          "num_stages": 4,
          "us": null,
          "valid": false,
          "max_abs_err": null,
          "captured": false
        },
        {
          "BLOCK_M": 16,
          "BLOCK_Q": 4,
          "TILE_SIZE": 128,
          "num_warps": 8,
          "num_stages": 2,
          "us": null,
          "valid": false,
          "max_abs_err": null,
          "captured": false
        },
        {
          "BLOCK_M": 16,
          "BLOCK_Q": 4,
          "TILE_SIZE": 128,
          "num_warps": 8,
          "num_stages": 3,
          "us": null,
          "valid": false,
          "max_abs_err": null,
          "captured": false
        },
        {
          "BLOCK_M": 16,
          "BLOCK_Q": 4,
          "TILE_SIZE": 128,
          "num_warps": 8,
          "num_stages": 4,
          "us": null,
          "valid": false,
          "max_abs_err": null,
          "captured": false
        },
        {
          "BLOCK_M": 32,
          "BLOCK_Q": 8,
          "TILE_SIZE": 16,
          "num_warps": 2,
          "num_stages": 2,
          "us": 17.609386,
          "valid": true,
          "max_abs_err": 0.0,
          "captured": true
        },
        {
          "BLOCK_M": 32,
          "BLOCK_Q": 8,
          "TILE_SIZE": 16,
          "num_warps": 2,
          "num_stages": 3,
          "us": 20.094293,
          "valid": true,
          "max_abs_err": 0.0,
          "captured": true
        },
        {
          "BLOCK_M": 32,
          "BLOCK_Q": 8,
          "TILE_SIZE": 16,
          "num_warps": 2,
          "num_stages": 4,
          "us": 20.309334,
          "valid": true,
          "max_abs_err": 0.0,
          "captured": true
        },
        {
          "BLOCK_M": 32,
          "BLOCK_Q": 8,
          "TILE_SIZE": 16,
          "num_warps": 4,
          "num_stages": 2,
          "us": 11.779413,
          "valid": true,
          "max_abs_err": 0.0,
          "captured": true
        },
        {
          "BLOCK_M": 32,
          "BLOCK_Q": 8,
          "TILE_SIZE": 16,
          "num_warps": 4,
          "num_stages": 3,
          "us": 12.885334,
          "valid": true,
          "max_abs_err": 0.0,
          "captured": true
        },
        {
          "BLOCK_M": 32,
          "BLOCK_Q": 8,
          "TILE_SIZE": 16,
          "num_warps": 4,
          "num_stages": 4,
          "us": 12.895573,
          "valid": true,
          "max_abs_err": 0.0,
          "captured": true
        },
        {
          "BLOCK_M": 32,
          "BLOCK_Q": 8,
          "TILE_SIZE": 16,
          "num_warps": 8,
          "num_stages": 2,
          "us": 12.844373,
          "valid": true,
          "max_abs_err": 0.0,
          "captured": true
        },
        {
          "BLOCK_M": 32,
          "BLOCK_Q": 8,
          "TILE_SIZE": 16,
          "num_warps": 8,
          "num_stages": 3,
          "us": 13.74208,
          "valid": true,
          "max_abs_err": 0.0,
          "captured": true
        },
        {
          "BLOCK_M": 32,
          "BLOCK_Q": 8,
          "TILE_SIZE": 16,
          "num_warps": 8,
          "num_stages": 4,
          "us": 13.725014,
          "valid": true,
          "max_abs_err": 0.0,
          "captured": true
        },
        {
          "BLOCK_M": 32,
          "BLOCK_Q": 8,
          "TILE_SIZE": 32,
          "num_warps": 2,
          "num_stages": 2,
          "us": 23.702186,
          "valid": false,
          "max_abs_err": 0.010925,
          "captured": true
        },
        {
          "BLOCK_M": 32,
          "BLOCK_Q": 8,
          "TILE_SIZE": 32,
          "num_warps": 2,
          "num_stages": 3,
          "us": 28.538879,
          "valid": false,
          "max_abs_err": 0.010925,
          "captured": true
        },
        {
          "BLOCK_M": 32,
          "BLOCK_Q": 8,
          "TILE_SIZE": 32,
          "num_warps": 2,
          "num_stages": 4,
          "us": 28.675413,
          "valid": false,
          "max_abs_err": 0.010925,
          "captured": true
        },
        {
          "BLOCK_M": 32,
          "BLOCK_Q": 8,
          "TILE_SIZE": 32,
          "num_warps": 4,
          "num_stages": 2,
          "us": 14.335999,
          "valid": false,
          "max_abs_err": 0.010925,
          "captured": true
        },
        {
          "BLOCK_M": 32,
          "BLOCK_Q": 8,
          "TILE_SIZE": 32,
          "num_warps": 4,
          "num_stages": 3,
          "us": 16.581974,
          "valid": false,
          "max_abs_err": 0.010925,
          "captured": true
        },
        {
          "BLOCK_M": 32,
          "BLOCK_Q": 8,
          "TILE_SIZE": 32,
          "num_warps": 4,
          "num_stages": 4,
          "us": 16.503466,
          "valid": false,
          "max_abs_err": 0.010925,
          "captured": true
        },
        {
          "BLOCK_M": 32,
          "BLOCK_Q": 8,
          "TILE_SIZE": 32,
          "num_warps": 8,
          "num_stages": 2,
          "us": 14.37696,
          "valid": false,
          "max_abs_err": 0.010925,
          "captured": true
        },
        {
          "BLOCK_M": 32,
          "BLOCK_Q": 8,
          "TILE_SIZE": 32,
          "num_warps": 8,
          "num_stages": 3,
          "us": 15.872,
          "valid": false,
          "max_abs_err": 0.010925,
          "captured": true
        },
        {
          "BLOCK_M": 32,
          "BLOCK_Q": 8,
          "TILE_SIZE": 32,
          "num_warps": 8,
          "num_stages": 4,
          "us": 15.882239,
          "valid": false,
          "max_abs_err": 0.010925,
          "captured": true
        },
        {
          "BLOCK_M": 32,
          "BLOCK_Q": 8,
          "TILE_SIZE": 64,
          "num_warps": 2,
          "num_stages": 2,
          "us": null,
          "valid": false,
          "max_abs_err": null,
          "captured": false
        },
        {
          "BLOCK_M": 32,
          "BLOCK_Q": 8,
          "TILE_SIZE": 64,
          "num_warps": 2,
          "num_stages": 3,
          "us": null,
          "valid": false,
          "max_abs_err": null,
          "captured": false
        },
        {
          "BLOCK_M": 32,
          "BLOCK_Q": 8,
          "TILE_SIZE": 64,
          "num_warps": 2,
          "num_stages": 4,
          "us": null,
          "valid": false,
          "max_abs_err": null,
          "captured": false
        },
        {
          "BLOCK_M": 32,
          "BLOCK_Q": 8,
          "TILE_SIZE": 64,
          "num_warps": 4,
          "num_stages": 2,
          "us": null,
          "valid": false,
          "max_abs_err": null,
          "captured": false
        },
        {
          "BLOCK_M": 32,
          "BLOCK_Q": 8,
          "TILE_SIZE": 64,
          "num_warps": 4,
          "num_stages": 3,
          "us": null,
          "valid": false,
          "max_abs_err": null,
          "captured": false
        },
        {
          "BLOCK_M": 32,
          "BLOCK_Q": 8,
          "TILE_SIZE": 64,
          "num_warps": 4,
          "num_stages": 4,
          "us": null,
          "valid": false,
          "max_abs_err": null,
          "captured": false
        },
        {
          "BLOCK_M": 32,
          "BLOCK_Q": 8,
          "TILE_SIZE": 64,
          "num_warps": 8,
          "num_stages": 2,
          "us": null,
          "valid": false,
          "max_abs_err": null,
          "captured": false
        },
        {
          "BLOCK_M": 32,
          "BLOCK_Q": 8,
          "TILE_SIZE": 64,
          "num_warps": 8,
          "num_stages": 3,
          "us": null,
          "valid": false,
          "max_abs_err": null,
          "captured": false
        },
        {
          "BLOCK_M": 32,
          "BLOCK_Q": 8,
          "TILE_SIZE": 64,
          "num_warps": 8,
          "num_stages": 4,
          "us": null,
          "valid": false,
          "max_abs_err": null,
          "captured": false
        },
        {
          "BLOCK_M": 32,
          "BLOCK_Q": 8,
          "TILE_SIZE": 128,
          "num_warps": 2,
          "num_stages": 2,
          "us": null,
          "valid": false,
          "max_abs_err": null,
          "captured": false
        },
        {
          "BLOCK_M": 32,
          "BLOCK_Q": 8,
          "TILE_SIZE": 128,
          "num_warps": 2,
          "num_stages": 3,
          "us": null,
          "valid": false,
          "max_abs_err": null,
          "captured": false
        },
        {
          "BLOCK_M": 32,
          "BLOCK_Q": 8,
          "TILE_SIZE": 128,
          "num_warps": 2,
          "num_stages": 4,
          "us": null,
          "valid": false,
          "max_abs_err": null,
          "captured": false
        },
        {
          "BLOCK_M": 32,
          "BLOCK_Q": 8,
          "TILE_SIZE": 128,
          "num_warps": 4,
          "num_stages": 2,
          "us": null,
          "valid": false,
          "max_abs_err": null,
          "captured": false
        },
        {
          "BLOCK_M": 32,
          "BLOCK_Q": 8,
          "TILE_SIZE": 128,
          "num_warps": 4,
          "num_stages": 3,
          "us": null,
          "valid": false,
          "max_abs_err": null,
          "captured": false
        },
        {
          "BLOCK_M": 32,
          "BLOCK_Q": 8,
          "TILE_SIZE": 128,
          "num_warps": 4,
          "num_stages": 4,
          "us": null,
          "valid": false,
          "max_abs_err": null,
          "captured": false
        },
        {
          "BLOCK_M": 32,
          "BLOCK_Q": 8,
          "TILE_SIZE": 128,
          "num_warps": 8,
          "num_stages": 2,
          "us": null,
          "valid": false,
          "max_abs_err": null,
          "captured": false
        },
        {
          "BLOCK_M": 32,
          "BLOCK_Q": 8,
          "TILE_SIZE": 128,
          "num_warps": 8,
          "num_stages": 3,
          "us": null,
          "valid": false,
          "max_abs_err": null,
          "captured": false
        },
        {
          "BLOCK_M": 32,
          "BLOCK_Q": 8,
          "TILE_SIZE": 128,
          "num_warps": 8,
          "num_stages": 4,
          "us": null,
          "valid": false,
          "max_abs_err": null,
          "captured": false
        },
        {
          "BLOCK_M": 64,
          "BLOCK_Q": 16,
          "TILE_SIZE": 16,
          "num_warps": 2,
          "num_stages": 2,
          "us": 46.885548,
          "valid": true,
          "max_abs_err": 0.0,
          "captured": true
        },
        {
          "BLOCK_M": 64,
          "BLOCK_Q": 16,
          "TILE_SIZE": 16,
          "num_warps": 2,
          "num_stages": 3,
          "us": 53.104639,
          "valid": true,
          "max_abs_err": 0.0,
          "captured": true
        },
        {
          "BLOCK_M": 64,
          "BLOCK_Q": 16,
          "TILE_SIZE": 16,
          "num_warps": 2,
          "num_stages": 4,
          "us": 50.274986,
          "valid": true,
          "max_abs_err": 0.0,
          "captured": true
        },
        {
          "BLOCK_M": 64,
          "BLOCK_Q": 16,
          "TILE_SIZE": 16,
          "num_warps": 4,
          "num_stages": 2,
          "us": 21.230933,
          "valid": true,
          "max_abs_err": 0.0,
          "captured": true
        },
        {
          "BLOCK_M": 64,
          "BLOCK_Q": 16,
          "TILE_SIZE": 16,
          "num_warps": 4,
          "num_stages": 3,
          "us": 20.404906,
          "valid": true,
          "max_abs_err": 0.0,
          "captured": true
        },
        {
          "BLOCK_M": 64,
          "BLOCK_Q": 16,
          "TILE_SIZE": 16,
          "num_warps": 4,
          "num_stages": 4,
          "us": 20.435627,
          "valid": true,
          "max_abs_err": 0.0,
          "captured": true
        },
        {
          "BLOCK_M": 64,
          "BLOCK_Q": 16,
          "TILE_SIZE": 16,
          "num_warps": 8,
          "num_stages": 2,
          "us": 18.35008,
          "valid": true,
          "max_abs_err": 0.0,
          "captured": true
        },
        {
          "BLOCK_M": 64,
          "BLOCK_Q": 16,
          "TILE_SIZE": 16,
          "num_warps": 8,
          "num_stages": 3,
          "us": 18.916693,
          "valid": true,
          "max_abs_err": 0.0,
          "captured": true
        },
        {
          "BLOCK_M": 64,
          "BLOCK_Q": 16,
          "TILE_SIZE": 16,
          "num_warps": 8,
          "num_stages": 4,
          "us": 18.91328,
          "valid": true,
          "max_abs_err": 0.0,
          "captured": true
        },
        {
          "BLOCK_M": 64,
          "BLOCK_Q": 16,
          "TILE_SIZE": 32,
          "num_warps": 2,
          "num_stages": 2,
          "us": null,
          "valid": false,
          "max_abs_err": null,
          "captured": false
        },
        {
          "BLOCK_M": 64,
          "BLOCK_Q": 16,
          "TILE_SIZE": 32,
          "num_warps": 2,
          "num_stages": 3,
          "us": null,
          "valid": false,
          "max_abs_err": null,
          "captured": false
        },
        {
          "BLOCK_M": 64,
          "BLOCK_Q": 16,
          "TILE_SIZE": 32,
          "num_warps": 2,
          "num_stages": 4,
          "us": null,
          "valid": false,
          "max_abs_err": null,
          "captured": false
        },
        {
          "BLOCK_M": 64,
          "BLOCK_Q": 16,
          "TILE_SIZE": 32,
          "num_warps": 4,
          "num_stages": 2,
          "us": null,
          "valid": false,
          "max_abs_err": null,
          "captured": false
        },
        {
          "BLOCK_M": 64,
          "BLOCK_Q": 16,
          "TILE_SIZE": 32,
          "num_warps": 4,
          "num_stages": 3,
          "us": null,
          "valid": false,
          "max_abs_err": null,
          "captured": false
        },
        {
          "BLOCK_M": 64,
          "BLOCK_Q": 16,
          "TILE_SIZE": 32,
          "num_warps": 4,
          "num_stages": 4,
          "us": null,
          "valid": false,
          "max_abs_err": null,
          "captured": false
        },
        {
          "BLOCK_M": 64,
          "BLOCK_Q": 16,
          "TILE_SIZE": 32,
          "num_warps": 8,
          "num_stages": 2,
          "us": null,
          "valid": false,
          "max_abs_err": null,
          "captured": false
        },
        {
          "BLOCK_M": 64,
          "BLOCK_Q": 16,
          "TILE_SIZE": 32,
          "num_warps": 8,
          "num_stages": 3,
          "us": null,
          "valid": false,
          "max_abs_err": null,
          "captured": false
        },
        {
          "BLOCK_M": 64,
          "BLOCK_Q": 16,
          "TILE_SIZE": 32,
          "num_warps": 8,
          "num_stages": 4,
          "us": null,
          "valid": false,
          "max_abs_err": null,
          "captured": false
        },
        {
          "BLOCK_M": 64,
          "BLOCK_Q": 16,
          "TILE_SIZE": 64,
          "num_warps": 2,
          "num_stages": 2,
          "us": null,
          "valid": false,
          "max_abs_err": null,
          "captured": false
        },
        {
          "BLOCK_M": 64,
          "BLOCK_Q": 16,
          "TILE_SIZE": 64,
          "num_warps": 2,
          "num_stages": 3,
          "us": null,
          "valid": false,
          "max_abs_err": null,
          "captured": false
        },
        {
          "BLOCK_M": 64,
          "BLOCK_Q": 16,
          "TILE_SIZE": 64,
          "num_warps": 2,
          "num_stages": 4,
          "us": null,
          "valid": false,
          "max_abs_err": null,
          "captured": false
        },
        {
          "BLOCK_M": 64,
          "BLOCK_Q": 16,
          "TILE_SIZE": 64,
          "num_warps": 4,
          "num_stages": 2,
          "us": null,
          "valid": false,
          "max_abs_err": null,
          "captured": false
        },
        {
          "BLOCK_M": 64,
          "BLOCK_Q": 16,
          "TILE_SIZE": 64,
          "num_warps": 4,
          "num_stages": 3,
          "us": null,
          "valid": false,
          "max_abs_err": null,
          "captured": false
        },
        {
          "BLOCK_M": 64,
          "BLOCK_Q": 16,
          "TILE_SIZE": 64,
          "num_warps": 4,
          "num_stages": 4,
          "us": null,
          "valid": false,
          "max_abs_err": null,
          "captured": false
        },
        {
          "BLOCK_M": 64,
          "BLOCK_Q": 16,
          "TILE_SIZE": 64,
          "num_warps": 8,
          "num_stages": 2,
          "us": null,
          "valid": false,
          "max_abs_err": null,
          "captured": false
        },
        {
          "BLOCK_M": 64,
          "BLOCK_Q": 16,
          "TILE_SIZE": 64,
          "num_warps": 8,
          "num_stages": 3,
          "us": null,
          "valid": false,
          "max_abs_err": null,
          "captured": false
        },
        {
          "BLOCK_M": 64,
          "BLOCK_Q": 16,
          "TILE_SIZE": 64,
          "num_warps": 8,
          "num_stages": 4,
          "us": null,
          "valid": false,
          "max_abs_err": null,
          "captured": false
        },
        {
          "BLOCK_M": 64,
          "BLOCK_Q": 16,
          "TILE_SIZE": 128,
          "num_warps": 2,
          "num_stages": 2,
          "us": null,
          "valid": false,
          "max_abs_err": null,
          "captured": false
        },
        {
          "BLOCK_M": 64,
          "BLOCK_Q": 16,
          "TILE_SIZE": 128,
          "num_warps": 2,
          "num_stages": 3,
          "us": null,
          "valid": false,
          "max_abs_err": null,
          "captured": false
        },
        {
          "BLOCK_M": 64,
          "BLOCK_Q": 16,
          "TILE_SIZE": 128,
          "num_warps": 2,
          "num_stages": 4,
          "us": null,
          "valid": false,
          "max_abs_err": null,
          "captured": false
        },
        {
          "BLOCK_M": 64,
          "BLOCK_Q": 16,
          "TILE_SIZE": 128,
          "num_warps": 4,
          "num_stages": 2,
          "us": null,
          "valid": false,
          "max_abs_err": null,
          "captured": false
        },
        {
          "BLOCK_M": 64,
          "BLOCK_Q": 16,
          "TILE_SIZE": 128,
          "num_warps": 4,
          "num_stages": 3,
          "us": null,
          "valid": false,
          "max_abs_err": null,
          "captured": false
        },
        {
          "BLOCK_M": 64,
          "BLOCK_Q": 16,
          "TILE_SIZE": 128,
          "num_warps": 4,
          "num_stages": 4,
          "us": null,
          "valid": false,
          "max_abs_err": null,
          "captured": false
        },
        {
          "BLOCK_M": 64,
          "BLOCK_Q": 16,
          "TILE_SIZE": 128,
          "num_warps": 8,
          "num_stages": 2,
          "us": null,
          "valid": false,
          "max_abs_err": null,
          "captured": false
        },
        {
          "BLOCK_M": 64,
          "BLOCK_Q": 16,
          "TILE_SIZE": 128,
          "num_warps": 8,
          "num_stages": 3,
          "us": null,
          "valid": false,
          "max_abs_err": null,
          "captured": false
        },
        {
          "BLOCK_M": 64,
          "BLOCK_Q": 16,
          "TILE_SIZE": 128,
          "num_warps": 8,
          "num_stages": 4,
          "us": null,
          "valid": false,
          "max_abs_err": null,
          "captured": false
        }
      ]
    },
    "rejection_sweep": {
      "tunable_tile_surface": false,
      "reason": "grid=(batch,) scalar loop over max_spec_len draft rows; no BLOCK_M/BLOCK_N constexpr -> re-tile headroom structurally nil",
      "t_sampling_us": 4.949333
    },
    "endtoend": {
      "cycle_us": 8244.179356,
      "tps_per_us": 0.056663,
      "attn_retile_endtoend_tps": 0.261297,
      "attn_eliminate_endtoend_tps_upperbound": 4.267392,
      "max_honest_endtoend_tps_delta": 0.261297
    },
    "body_ok": true,
    "lm_ok": true,
    "captured_flags": {
      "fa2": true,
      "tri3d": true,
      "lmhead": true,
      "sampling": true,
      "verify_forward": true
    },
    "peak_vram_gib": 0.528613
  },
  "verdict": {
    "max_honest_endtoend_tps_delta": 0.2613,
    "any_nonattn_triton_over_2tps": false,
    "int4_gemm_dominant": true,
    "int4_gemm_frac_of_verify": 0.8509,
    "int4_gemm_vendored_marlin_no_selectable_tiling": true,
    "attn_frac_of_verify": 0.1419,
    "attn_frac_corroborates_441_445": false,
    "attn_tunable_tri3d_frac_of_attn": 0.0898,
    "attn_best_cfg": "BM16_BQ4_TS16_w4_s2",
    "attn_kernel_sweepmin_speedup_pct": 5.841,
    "attn_kernel_confirmed_speedup_pct": 6.108,
    "winner_curse_shrinks_delta": false,
    "beats_realized_467": true,
    "beats_deployed_481": false,
    "wirbel_modeled_tps": 15.86,
    "wirbel_modeled_implied_verify_saving_us": 279.9,
    "ppl": 2.3772,
    "ppl_cap": 2.42,
    "tps_at_realized_frontier": 467.14,
    "self_test_passes": true
  },
  "self_test": {
    "a_cycle_us_matches": true,
    "b_slope_positive": true,
    "c_map_zero": true,
    "d_map_monotone": true,
    "e_wirbel_implies_large_saving": true,
    "f_synth_fracs_sum_1": true,
    "g_gemm_dominant_true": true,
    "h_nonattn_over2_false": true,
    "i_attn_corroborates": true,
    "j_no_beat_deployed": true,
    "k_elim90_under_wirbel": true,
    "l_elim90_value": true,
    "m_ppl_neutral": true,
    "n_nan_clean": true,
    "o_winner_curse_detected": true,
    "p_honest_clamp_nonneg": true,
    "_n_pass": 16,
    "_n_total": 16
  },
  "wandb_run_id": "crrq2e1y"
}